<?xml version="1.0" encoding="utf-8"?>
<!DOCTYPE makefile SYSTEM "makefile.dtd">
<makefile>
  <type>lib</type>
  <project_name>ogm_sock</project_name>
  <sources>
    <file>ghbyaddr.c</file>
    <file>ogm_sock.c</file>
    <file>sockconn.c</file>
    <file>sockmisc.c</file>
    <file>urlhead.c</file>
    <file>urlhlog.c</file>
  </sources>
  <platforms>
    <platform name="win">
      <option name="NAME">ogm_sock</option>
      <option name="ADD_INC"/>
      <option name="ADD_LIBR">ogm_gen.lib</option>
      <option name="ADD_LIBD">$(ADD_LIBR)</option>
      <option name="ADD_LIBP">$(ADD_LIBR)</option>
    </platform>
    <platform name="linux">
      <option name="NAME">ogsock</option>
      <option name="ADD_CFLAGS"/>
      <option name="ADD_LIBR">-loggen</option>
      <option name="ADD_LIBD">$(ADD_LIBR)</option>
      <option name="ADD_LIBP">$(ADD_LIBR)</option>
    </platform>
  </platforms>
</makefile>
