<?xml version="1.0"?>
<!DOCTYPE makefile SYSTEM "makefile.dtd">
<makefile>
  <type>lib</type>
  <project_name>ogm_stm</project_name>
  <revision>$Revision: 1171 $</revision>
  <sources>
    <file>istm.c</file>
    <file>stmlev.c</file>
    <file>stmlevcompute.c</file>
    <file>stmlevutils.c</file>
  </sources>
  <platforms>
    <platform name="win">
      <option name="NAME">ogm_stm</option>
      <option name="ADD_LIBR">ogm_gen.lib ogm_thr.lib ogm_msg.lib ogm_uni.lib ogm_auta.lib</option>
      <option name="ADD_LIBD">$(ADD_LIBR)</option>
      <option name="ADD_LIBP">$(ADD_LIBR)</option>
    </platform>
    <platform name="linux">
      <option name="NAME">ogstm</option>
      <option name="ADD_CFLAGS">-I$(OG_REPO_PATH)/sources/include/glib-2.0</option>
      <option name="ADD_LIBR">-lglib-2.0 -logheap -loggen -logmsg -loguni -loglip</option>
      <option name="ADD_LIBD">$(ADD_LIBR)</option>
      <option name="ADD_LIBP">$(ADD_LIBR)</option>
    </platform>
  </platforms>
</makefile>
