<?xml version="1.0" encoding="utf-8"?>
<!DOCTYPE makefile SYSTEM "makefile.dtd">
<makefile>
  <type>lib</type>
  <project_name>ogm_http</project_name>
  <sources>
    <file>httpba.c</file>
    <file>httpmem.c</file>
    <file>httphrl.c</file>
    <file>httphrli.c</file>
    <file>httphrlo.c</file>
    <file>httphrr.c</file>
    <file>httphrscan.c</file>
    <file>httphrty.c</file>
    <file>ihttp.c</file>
  </sources>
  <platforms>
    <platform name="win">
      <option name="NAME">ogm_http</option>
      <option name="ADD_INC"/>
      <option name="ADD_LIBR">ogm_aut.lib ogm_msg.lib ogm_gen.lib</option>
      <option name="ADD_LIBD">$(ADD_LIBR)</option>
      <option name="ADD_LIBP">$(ADD_LIBR)</option>
    </platform>
    <platform name="linux">
      <option name="NAME">oghttp</option>
      <option name="ADD_CFLAGS"/>
      <option name="ADD_LIBR">-logaut -logmsg -loggen</option>
      <option name="ADD_LIBD">$(ADD_LIBR)</option>
      <option name="ADD_LIBP">$(ADD_LIBR)</option>
    </platform>
  </platforms>
</makefile>
