<?xml version="1.0" encoding="utf-8"?>
<!DOCTYPE makefile SYSTEM "makefile.dtd">
<makefile>
  <type>lib</type>
  <project_name>ogm_uci</project_name>
  <sources>
    <file>iuci.c</file>
    <file>iucic.c</file>
    <file>iucis.c</file>
    <file>uciba.c</file>
    <file>ucicba.c</file>
    <file>ucimem.c</file>
    <file>ucircreq.c</file>
    <file>uciread.c</file>
    <file>ucisba.c</file>
    <file>ucismem.c</file>
    <file>ucisread.c</file>
    <file>uciswrite.c</file>
  </sources>
  <platforms>
    <platform name="win">
      <option name="NAME">ogm_uci</option>
      <option name="ADD_INC"/>
      <option name="ADD_LIBR">ogm_http.lib ogm_sock.lib ogm_msg.lib ogm_gen.lib</option>
      <option name="ADD_LIBD">$(ADD_LIBR)</option>
      <option name="ADD_LIBP">$(ADD_LIBR)</option>
    </platform>
    <platform name="linux">
      <option name="NAME">oguci</option>
      <option name="ADD_CFLAGS"/>
      <option name="ADD_LIBR">-loggen -loghttp -logsock -logmsg</option>
      <option name="ADD_LIBD">$(ADD_LIBR)</option>
      <option name="ADD_LIBP">$(ADD_LIBR)</option>
    </platform>
  </platforms>
</makefile>
