<?xml version="1.0" encoding="utf-8"?>
<!DOCTYPE makefile SYSTEM "makefile.dtd">
<makefile>
  <type>lib</type>
  <project_name>ogm_thr</project_name>
  <sources>
    <file>ogm_thr.c</file>
    <file>thrlog.c</file>
    <file>thrmutex.c</file>
    <file>thrsem.c</file>
    <file>thrterm.c</file>
  </sources>
  <platforms>
    <platform name="win">
      <option name="NAME">ogm_thr</option>
      <option name="ADD_INC"/>
      <option name="ADD_LIBR">ogm_gen.lib</option>
      <option name="ADD_LIBD">$(ADD_LIBR)</option>
      <option name="ADD_LIBP">$(ADD_LIBR)</option>
    </platform>
    <platform name="linux">
      <option name="NAME">ogthr</option>
      <option name="ADD_CFLAGS"/>
      <option name="ADD_LIBR">-loggen</option>
      <option name="ADD_LIBD">$(ADD_LIBR)</option>
      <option name="ADD_LIBP">$(ADD_LIBR)</option>
    </platform>
  </platforms>
</makefile>
