<?xml version="1.0" encoding="utf-8"?>
<!DOCTYPE makefile SYSTEM "makefile.dtd">
<makefile>
  <type>lib</type>
  <project_name>ogm_ltras</project_name>
  <sources>
    <file>iltras.c</file>
    <file>ltras.c</file>
    <file>ltrasba.c</file>
    <file>ltrasparse.c</file>
    <file>ltrasfalse.c</file>
    <file>ltrasfalsec.c</file>
    <file>ltrasfc.c</file>
    <file>ltrasfcb.c</file>
    <file>ltrasm.c</file>
    <file>ltrasmadd.c</file>
    <file>ltrasmba.c</file>
    <file>ltrasmconf.c</file>
    <file>ltrasmcost.c</file>
    <file>ltrasmcut.c</file>
    <file>ltrasmcutc.c</file>
    <file>ltrasmdel.c</file>
    <file>ltrasmem.c</file>
    <file>ltrasmexcept.c</file>
    <file>ltrasmexceptc.c</file>
    <file>ltrasmlem1.c</file>
    <file>ltrasmlem2.c</file>
    <file>ltrasmtra.c</file>
    <file>ltrasmmodule.c</file>
    <file>ltrasmlog.c</file>
    <file>ltrasmod.c</file>
    <file>ltrasmpaste.c</file>
    <file>ltrasmphon.c</file>
    <file>ltrasmref.c</file>
    <file>ltrasmswap.c</file>
    <file>ltrasmtest.c</file>
    <file>ltrasmterm.c</file>
    <file>ltrasmtrans.c</file>
    <file>ltrasmword.c</file>
    <file>ltrasmsplit.c</file>
    <file>ltrasmsplitc.c</file>
    <file>ltrasnode.c</file>
    <file>ltrasope.c</file>
    <file>ltrasparam.c</file>
    <file>ltrasres.c</file>
    <file>ltrassug.c</file>
  </sources>
  <platforms>
    <platform name="win">
      <option name="NAME">libogltras</option>
      <option name="ADD_INC"/>
      <option name="ADD_LIBR">libogltrap.lib libogheap.lib ogm_stm.lib ogm_pho.lib ogm_ldi.lib ogm_aut.lib ogm_rqp.lib ogm_lip.lib ogm_xml.lib ogm_msg.lib ogm_uni.lib ogm_thr.lib ogm_gen.lib</option>
      <option name="ADD_LIBD">$(ADD_LIBR)</option>
      <option name="ADD_LIBP">$(ADD_LIBR)</option>
    </platform>
    <platform name="linux">
      <option name="NAME">ogltras</option>
      <option name="ADD_CFLAGS"/>
      <option name="ADD_LIBR">-lm -logaut -loggen -logheap -logldi -loglip -logltrap -logmsg -logpho -logrqp -logstm -loguni -logxml</option>
      <option name="ADD_LIBD">$(ADD_LIBR)</option>
      <option name="ADD_LIBP">$(ADD_LIBR)</option>
    </platform>
  </platforms>
</makefile>
