<?xml version="1.0" encoding="utf-8"?>
<!DOCTYPE makefile SYSTEM "makefile.dtd">
<makefile>
  <type>prog</type>
  <project_name>ogfemin</project_name>
  <sources>
    <file>ogfemin.c</file>
  </sources>
  <platforms>
    <platform name="win">
      <option name="NAME">ogfemin.exe</option>
      <option name="ADD_LIBR">ogm_aut.lib ogm_gen.lib ogm_thr.lib</option>
      <option name="ADD_LIBD">$(ADD_LIBR)</option>
      <option name="ADD_LIBP">$(ADD_LIBR)</option>
    </platform>
    <platform name="linux">
      <option name="NAME">ogfemin</option>
      <option name="ADD_CFLAGS"></option>
      <option name="ADD_LIBS">-logaut -logthr -loggen</option>
    </platform>
  </platforms>
</makefile>
