<?xml version="1.0" encoding="utf-8"?>
<!DOCTYPE makefile SYSTEM "makefile.dtd">
<makefile>
  <type>prog</type>
  <project_name>ogltrac</project_name>
  <sources>
    <file>ogltrac.c</file>
  </sources>
  <platforms>
    <platform name="win">
      <option name="NAME">ogltrac.exe</option>
      <option name="ADD_LIBR">libogltrac.lib ogm_auta.lib ogm_thr.lib ogm_gen.lib ogm_uni.lib ogm_msg.lib</option>
      <option name="ADD_LIBD">$(ADD_LIBR)</option>
      <option name="ADD_LIBP">$(ADD_LIBR)</option>
    </platform>
    <platform name="linux">
      <option name="NAME">ogltrac</option>
      <option name="ADD_CFLAGS"/>
      <option name="ADD_LIBR">-logauta -loggen -logltrac -logmsg -logthr</option>
      <option name="ADD_LIBD">$(ADD_LIBR)</option>
      <option name="ADD_LIBP">$(ADD_LIBR)</option>
    </platform>
  </platforms>
</makefile>
