<?xml version="1.0" encoding="utf-8"?>
<!DOCTYPE makefile SYSTEM "makefile.dtd">
<makefile>
  <type>lib</type>
  <project_name>ogm_ltrap</project_name>
  <sources>
    <file>iltrap.c</file>
    <file>ltrap.c</file>
    <file>ltrapba.c</file>
    <file>ltraplog.c</file>
    <file>ltrapseq.c</file>
    <file>ltrapsmall.c</file>
    <file>ltrapsol.c</file>
    <file>ltrapspan.c</file>
    <file>ltrapspansol.c</file>
    <file>ltrapsolution.c</file>
  </sources>
  <platforms>
    <platform name="win">
      <option name="NAME">libogltrap</option>
      <option name="ADD_INC"/>
      <option name="ADD_LIBR">ogm_aut.lib ogm_uni.lib ogm_msg.lib ogm_thr.lib ogm_gen.lib</option>
      <option name="ADD_LIBD">$(ADD_LIBR)</option>
      <option name="ADD_LIBP">$(ADD_LIBR)</option>
    </platform>
    <platform name="linux">
      <option name="NAME">ogltrap</option>
      <option name="ADD_CFLAGS"/>
      <option name="ADD_LIBR">-logaut -loggen -logmsg -loguni</option>
      <option name="ADD_LIBD">$(ADD_LIBR)</option>
      <option name="ADD_LIBP">$(ADD_LIBR)</option>
    </platform>
  </platforms>
</makefile>
