<?xml version="1.0" encoding="utf-8"?>
<!DOCTYPE makefile SYSTEM "makefile.dtd">
<makefile>
  <type>prog</type>
  <project_name>ogsysi</project_name>
  <sources>
    <file>ogsysi.c</file>
  </sources>
  <platforms>
    <platform name="win">
      <option name="NAME">ogsysi.exe</option>
      <option name="ADD_LIBR">libogpsync.lib libogsysi.lib ogm_msg.lib ogm_gen.lib</option>
      <option name="ADD_LIBD">$(ADD_LIBR)</option>
      <option name="ADD_LIBP">$(ADD_LIBR)</option>
    </platform>
    <platform name="linux">
      <option name="NAME">ogsysi</option>
      <option name="LINKER_NO_UNDEF">yes</option>
      <option name="ADD_CFLAGS"></option>
      <option name="ADD_LIBS">-logsysi -lglib-2.0 -loggen -lxml2 -logmisc -logthr -logmsg -logsam -logpsync</option>
    </platform>
  </platforms>
</makefile>
