<?xml version="1.0" encoding="utf-8"?>
<!DOCTYPE makefile SYSTEM "makefile.dtd">
<makefile>
  <type>lib</type>
  <project_name>ogm_ghbn</project_name>
  <sources>
    <file>ghbn.c</file>
    <file>ghbn_to.c</file>
    <file>ighbn.c</file>
  </sources>
  <platforms>
    <platform name="win">
      <option name="NAME">ogm_ghbn</option>
      <option name="ADD_INC"/>
      <option name="ADD_LIBR">ogm_aut.lib ogm_xpt.lib ogm_thr.lib ogm_gen.lib</option>
      <option name="ADD_LIBD">$(ADD_LIBR)</option>
      <option name="ADD_LIBP">$(ADD_LIBR)</option>
    </platform>
    <platform name="linux">
      <option name="NAME">ogghbn</option>
      <option name="ADD_CFLAGS"/>
      <option name="ADD_LIBR">-logaut -loggen -logxpt</option>
      <option name="ADD_LIBD">$(ADD_LIBR)</option>
      <option name="ADD_LIBP">$(ADD_LIBR)</option>
    </platform>
  </platforms>
</makefile>
