<?xml version="1.0" encoding="utf-8"?>
<!DOCTYPE makefile SYSTEM "makefile.dtd">
<makefile>
  <type>lib</type>
  <project_name>ogm_uni</project_name>
  <sources>
    <file>cjkpunct.c</file>
    <file>convunic.c</file>
    <file>cp1250.c</file>
    <file>cp1251.c</file>
    <file>cp1252.c</file>
    <file>cp1256.c</file>
    <file>cp850.c</file>
    <file>cp866.c</file>
    <file>cp8859_2.c</file>
    <file>cp8859_5.c</file>
    <file>cpbig5.c</file>
    <file>cp936.c</file>
    <file>cpgb2312.c</file>
    <file>cpname.c</file>
    <file>cpon.c</file>
    <file>cptocp.c</file>
    <file>cptouni.c</file>
    <file>getcp.c</file>
    <file>isuni.c</file>
    <file>isutf8.c</file>
    <file>ogja.c</file>
    <file>unipos.c</file>
    <file>unitocp.c</file>
    <file>utf8.c</file>
    <file>utf8per.c</file>
    <file>utocp.c</file>
  </sources>
  <platforms>
    <platform name="linux">
      <option name="NAME">oguni</option>
      <option name="ADD_CFLAGS"/>
      <option name="ADD_LIBR">-logauta -loggen -lglib-2.0</option>
      <option name="ADD_LIBD">$(ADD_LIBR)</option>
      <option name="ADD_LIBP">$(ADD_LIBR)</option>
    </platform>
  </platforms>
</makefile>
