<?xml version="1.0" encoding="utf-8"?>
<!DOCTYPE makefile SYSTEM "makefile.dtd">
<makefile>
  <type>prog</type>
  <project_name>ogucic</project_name>
  <sources>
    <file>ogucic.c</file>
  </sources>
  <platforms>
    <platform name="win">
      <option name="NAME">ogucic.exe</option>
      <option name="ADD_LIBR">ogm_uci.lib ogm_sock.lib ogm_msg.lib ogm_gen.lib</option>
      <option name="ADD_LIBD">$(ADD_LIBR)</option>
      <option name="ADD_LIBP">$(ADD_LIBR)</option>
    </platform>
    <platform name="linux">
      <option name="NAME">ogucic</option>
      <option name="ADD_CFLAGS"/>
      <option name="ADD_LIBR">-loggen -logsock -logmsg -loguci</option>
      <option name="ADD_LIBD">$(ADD_LIBR)</option>
      <option name="ADD_LIBP">$(ADD_LIBR)</option>
    </platform>
  </platforms>
</makefile>
