<?xml version="1.0" encoding="utf-8"?>
<!DOCTYPE makefile SYSTEM "makefile.dtd">
<makefile>
  <type>lib</type>
  <project_name>ogm_sysi</project_name>
  <sources>
    <file>isysi.c</file>
    <file>sysiwrite.c</file>
    <file>sysiread.c</file>
    <file>sysilog.c</file>
  </sources>
  <platforms>
    <platform name="win">
      <option name="NAME">libogsysi</option>
      <option name="ADD_INC"/>
      <option name="ADD_LIBR">ogm_msg.lib ogm_gen.lib libogmisc.lib libogsam.lib libogpsync.lib</option>
      <option name="ADD_LIBD">$(ADD_LIBR)</option>
      <option name="ADD_LIBP">$(ADD_LIBR)</option>
    </platform>
    <platform name="linux">
      <option name="NAME">ogsysi</option>
      <option name="ADD_CFLAGS"/>
      <option name="LINKER_NO_UNDEF">yes</option>
      <option name="ADD_LIBR">-logmsg -loggen -logthr -lglib-2.0 -lgthread-2.0</option>
      <option name="ADD_LIBD">$(ADD_LIBR)</option>
      <option name="ADD_LIBP">$(ADD_LIBR)</option>
    </platform>
  </platforms>
</makefile>
