<?xml version="1.0" encoding="utf-8"?>
<!DOCTYPE makefile SYSTEM "makefile.dtd">
<makefile>
  <type>lib</type>
  <project_name>ogm_pho</project_name>
  <sources>
    <file>ipho.c</file>
    <file>pho.c</file>
    <file>phoanaly.c</file>
    <file>phoaut.c</file>
    <file>phoba.c</file>
    <file>phoclass.c</file>
    <file>phoexp.c</file>
    <file>phoforma.c</file>
    <file>phomatch.c</file>
    <file>phomem.c</file>
    <file>phoreadc.c</file>
    <file>phorule.c</file>
    <file>phorules.c</file>
    <file>phowrite.c</file>
  </sources>
  <platforms>
    <platform name="win">
      <option name="NAME">ogm_pho</option>
      <option name="ADD_INC"/>
      <option name="ADD_LIBR">ogm_thr.lib ogm_xml.lib ogm_uni.lib ogm_aut.lib ogm_msg.lib ogm_gen.lib</option>
      <option name="ADD_LIBD">$(ADD_LIBR)</option>
      <option name="ADD_LIBP">$(ADD_LIBR)</option>
    </platform>
    <platform name="linux">
      <option name="NAME">ogpho</option>
      <option name="ADD_CFLAGS"/>
      <option name="ADD_LIBR">-logaut -loggen -logmsg -loguni -logxml</option>
      <option name="ADD_LIBD">$(ADD_LIBR)</option>
      <option name="ADD_LIBP">$(ADD_LIBR)</option>
    </platform>
  </platforms>
</makefile>
